### ISSUE TITLE
Unable to connect on Windows 10

### ISSUE THREAD

**Issue by templetree** [aws/aws-iot-device-sdk-python#255]
Hi I am using python SDK to connect thing using MQTT.
The policy is set to accept all connections.
`{
  "Version": "2012-10-17",
  "Statement": [
    {
      "Effect": "Allow",
      "Action": "iot:*",
      "Resource": "*"
    }
  ]
}`
However each time I try to connect I get the following error:

>  File ".\awsmqttclient.py", line 22, in <module>
    myMQTTClient.connect()
  File "C:\Users\Sachin\AppData\Local\Packages\PythonSoftwareFoundation.Python.3.8_qbz5n2kfra8p0\LocalCache\local-packages\Python38\site-packages\AWSIoTPythonSDK\MQTTLib.py", line 513, in connect
    return self._mqtt_core.connect(keepAliveIntervalSecond)
  File "C:\Users\Sachin\AppData\Local\Packages\PythonSoftwareFoundation.Python.3.8_qbz5n2kfra8p0\LocalCache\local-packages\Python38\site-packages\AWSIoTPythonSDK\core\protocol\mqtt_core.py", line 199, in connect
    raise connectTimeoutException()
AWSIoTPythonSDK.exception.AWSIoTExceptions.connectTimeoutException

Here is the dump:
"No.","Time","Source","Destination","Protocol","Length","Info"
"11","2.573896","192.168.1.7","13.232.234.97","TCP","66","53493  >  8883 [SYN] Seq=0 Win=64240 Len=0 MSS=1460 WS=256 SACK_PERM=1"
"12","2.603847","13.232.234.97","192.168.1.7","TCP","66","8883  >  53493 [SYN, ACK] Seq=0 Ack=1 Win=26883 Len=0 MSS=1412 SACK_PERM=1 WS=256"
"13","2.604067","192.168.1.7","13.232.234.97","TCP","54","53493  >  8883 [ACK] Seq=1 Ack=1 Win=131072 Len=0"
"14","2.614661","192.168.1.7","13.232.234.97","TLSv1.2","571","Client Hello"
"15","2.645853","13.232.234.97","192.168.1.7","TCP","54","8883  >  53493 [ACK] Seq=1 Ack=518 Win=28160 Len=0"
"16","2.646741","13.232.234.97","192.168.1.7","TCP","1466","8883  >  53493 [ACK] Seq=1 Ack=518 Win=28160 Len=1412 [TCP segment of a reassembled PDU]"
"17","2.646742","13.232.234.97","192.168.1.7","TCP","1466","8883  >  53493 [ACK] Seq=1413 Ack=518 Win=28160 Len=1412 [TCP segment of a reassembled PDU]"
"18","2.647014","192.168.1.7","13.232.234.97","TCP","54","53493  >  8883 [ACK] Seq=518 Ack=2825 Win=131072 Len=0"
"19","2.659134","13.232.234.97","192.168.1.7","TCP","1466","8883  >  53493 [ACK] Seq=2825 Ack=518 Win=28160 Len=1412 [TCP segment of a reassembled PDU]"
"20","2.659141","13.232.234.97","192.168.1.7","TLSv1.2","1170","Server Hello, Certificate, Server Key Exchange, Certificate Request, Server Hello Done"
"21","2.659725","192.168.1.7","13.232.234.97","TCP","54","53493  >  8883 [ACK] Seq=518 Ack=5353 Win=131072 Len=0"
"22","2.670075","192.168.1.7","13.232.234.97","TLSv1.2","1326","Certificate, Client Key Exchange, Certificate Verify, Change Cipher Spec, Encrypted Handshake Message"
"23","2.718922","13.232.234.97","192.168.1.7","TLSv1.2","105","Change Cipher Spec, Encrypted Handshake Message"
"24","2.720898","192.168.1.7","13.232.234.97","TLSv1.2","134","Application Data"
"25","2.760424","13.232.234.97","192.168.1.7","TCP","54","[TCP Previous segment not captured] 8883  >  53493 [FIN, ACK] Seq=5435 Ack=1870 Win=30720 Len=0"
"26","2.760595","192.168.1.7","13.232.234.97","TCP","54","[TCP Dup ACK 24#1] 53493  >  8883 [ACK] Seq=1870 Ack=5404 Win=131072 Len=0"
"27","2.778850","13.232.234.97","192.168.1.7","TCP","85","[TCP Out-Of-Order] 8883  >  53493 [PSH, ACK] Seq=5404 Ack=1870 Win=30720 Len=31"
"28","2.779049","192.168.1.7","13.232.234.97","TCP","54","53493  >  8883 [ACK] Seq=1870 Ack=5436 Win=131072 Len=0"
"29","2.779403","192.168.1.7","13.232.234.97","TCP","54","53493  >  8883 [FIN, ACK] Seq=1870 Ack=5436 Win=131072 Len=0"
"30","2.807988","13.232.234.97","192.168.1.7","TCP","54","8883  >  53493 [ACK] Seq=5436 Ack=1871 Win=30720 Len=0"

**Comment by TingDaoK** [comment]
It seems like the connection failed after TLS. 
Can you check whether your certificate is attached to the policy or not? If not, please follow https://docs.aws.amazon.com/iot/latest/developerguide/attach-policy-to-certificate.html and try again. Else, please provide us more information about your security settings.
